208,Portuguese Podengo,"<p>Portuguese Podengos are lively, agile, playful, alert, highly intelligent but not always easy to train, independent yet loving with the family and sometimes suspicious of strangers. The breed's two sizes have different jobs: the larger hunts deer and boar and the medium-sized hunts rabbit. In the U.S, they are successful in coursing, agility, nose work, barn hunt, rally and in the conformation ring.</p>",Miscellaneous Class,Portugal,10-15 years,"Portuguese Podengo Pequeno, Portuguese Sheepdog, Portuguese Pointer, Pharaoh Hound, Ibizan Hound",alert / independent / intelligent,4,5,3,2,5,0,"['Smooth', 'Wiry']",1,4,5,4,3,4,3,3,22,22,44,44
209,Portuguese Podengo Pequeno,"Classified as a hound, the alert and playful little Portuguese Podengo Pequeno is a quick, athletic rabbit hunter of ancient lineage. Pequenos love to run, romp, and chase when outdoors but make charming and well-mannered housemates.",Hound Group,Portugal,12-15 years,"Portuguese Podengo, Petit Basset Griffon Venden, Australian Terrier, Jagdterrier, Dachshund",playful / charming / lively,4,5,3,2,5,0,"['Smooth', 'Wiry']",1,4,5,4,3,4,3,3,8,12,9,13
210,Portuguese Pointer,<p>The Portuguese Pointer is a very old hunting breed bred to work closely with its handler. They are enthusiastic in their work and very dedicated to their owner.</p>,Foundation Stock Service,Portugal,14 years,"German Shorthaired Pointer, Pointer, Braque du Bourbonnais, Braque Francais Pyrenean, Pudelpointer",energetic / affectionate / smart,4,5,3,1,5,0,['Smooth'],2,5,3,5,4,4,3,5,20.5,22,35,59
211,Portuguese Sheepdog,"<p>The Portuguese Sheepdog is exceptionally intelligent and lively. Very devoted to the shepherd and his herd, he can be somewhat wary of strangers and vigilant at night. Today, he is also an excellent companion, sporting and guard dog. He is known for his skillful ability to keep livestock in pastures and also for searching out stray animals. He is always vigilant and successfully alerts if predators are in the area. This breed is extremely devoted to its work and conducts it with joy and pleasure.</p>",Foundation Stock Service,Portugal,12-13 years,"Rafeiro do Alentejo, Schapendoes, Polish Lowland Sheepdog, Bergamasco Sheepdog, Pyrenean Shepherd",intelligent / devoted / lively,4,5,3,2,3,0,['Wavy'],2,4,3,4,3,3,2,5,16.5,21.5,37.5,59
212,Portuguese Water Dog,"<p>The bright and biddable Portuguese Water Dog was bred to be an all-around fisherman's helper. The robust, medium-sized body is covered by a coat of tight, low-shedding curls. PWDs are eager and athletic companions built for water work.</p>",Working Group,Portugal,11-13 years,"Irish Water Spaniel, Barbet, Spanish Water Dog, American Water Spaniel",affectionate / adventurous / athletic,5,5,3,4,5,0,"['Wavy', 'Curly']",2,5,4,5,4,5,2,5,17,23,35,60
213,Presa Canario,<p>The Presa Canario has a calm appearance and attentive expression. He is especially suited to guarding and traditionally used for herding cattle.</p>,Foundation Stock Service,Spain,9-11 years,"Cane Corso, Dogo Argentino, Mastiff, Tosa, Thai Ridgeback",strong-willed / confident / calm,2,2,3,1,1,0,['Smooth'],4,2,1,3,1,1,3,3,22,26,84,110
214,Pudelpointer,"<p>The Pudelpointer is a calm, self-controlled, versatile gun dog with a distinct hunting instinct and lacks game or gun shyness. In his native country of Germany, he has always ranked high in performance tests and in the field. This breed is enjoyed and valued for its desire and drive.</p>",Foundation Stock Service,Germany,14 years,"German Wirehaired Pointer, Wirehaired Pointing Griffon, Wirehaired Vizsla, Slovakian Wirehaired Pointer, German Longhaired Pointer",friendly / smart / willing to please,5,5,3,1,3,0,"['Rough', 'Smooth', 'Wiry']",3,4,3,4,3,3,3,5,22,26,45,70
215,Pug,"Once the mischievous companion of Chinese emperors, and later the mascot of Holland's royal House of Orange, the small but solid Pug is today adored by his millions of fans around the world. Pugs live to love and to be loved in return.",Toy Group,China,13-15 years,"Pekingese, Japanese Chin, French Bulldog, Boston Terrier, Shih Tzu",charming / loving / mischievous,5,5,1,2,5,0,['Smooth'],1,3,4,3,5,5,4,4,10,13,14,18
216,Puli,"<p>No other breed can be mistaken for the Puli, a compact but powerful herder covered from head to tail with profuse, naturally occurring cords. Bred to work closely with humans, these agile and faithful little dynamos are quick learners.</p>",Herding Group,Hungary,10-15 years,"Komondor, Pumi, Croatian Sheepdog, Bergamasco Sheepdog, Polish Lowland Sheepdog",loyal / smart / home-loving,4,5,3,5,3,0,"['Double', 'Corded']",2,3,3,5,3,3,1,5,16,17,25,35
217,Pumi,"A compact, nimble-footed herder of Hungarian origin, the Pumi is easily recognized by a corkscrew-curled coat, two-thirds erect ears, and distinctive whimsical expression. The breed is famed for its intelligence, agility, and boldness.",Herding Group,Hungary,12-13 years,"Puli, Mudi, Romanian Mioritic Shepherd Dog, Croatian Sheepdog, Pyrenean Shepherd",energetic / lively / ready to work,4,5,3,2,3,0,"['Wavy', 'Curly']",2,5,3,5,3,4,1,5,15,18.5,22,29
218,Pyrenean Mastiff,"<p>A centuries-old, rare breed from the Pyrenees Mountains in Spain, this livestock guardian protected flocks from wolves, bears and thieves. After the decline of predators in the region they became property guards and companions. Today, while they are still an effective guardian, many families have found the joy of owning the gentle and loving, yet independent, Pyrenean Mastiff.</p>",Miscellaneous Class,Spain,10-12 years,"Saint Bernard, Estrela Mountain Dog, Tibetan Mastiff, Tornjak, Newfoundland",gentle / brave / noble,3,4,4,3,4,0,['Double'],5,2,4,2,3,3,4,2,28,31,120,190
219,Pyrenean Shepherd,"<p>Enthusiastic, mischievous, and whip-smart, the Pyrenean Shepherd is an indefatigable herder descended from ancient sheepdogs of the Pyrenees mountains. Tough and sinewy Pyr Sheps come in 'rough-faced' and 'smooth-faced' coat varieties.</p>",Herding Group,France,17-19 years,"Berger Picard, Dutch Shepherd, Croatian Sheepdog, Romanian Mioritic Shepherd Dog, Mudi",active / affectionate / enthusiastic,4,5,4,2,3,0,"['Rough', 'Smooth']",2,5,3,5,3,5,3,5,15,21,15,30
220,Rafeiro do Alentejo,"<p>The Rafeiro do Alentejo is an excellent farm and estate watch dog. He is also a very useful livestock protector, being more vigilant at night and very serious when guarding territory or any other property entrusted to him. He has a calm and confident expression.</p>",Foundation Stock Service,Portugal,12-14 years,"Anatolian Shepherd Dog, Kuvasz, Tornjak, Central Asian Shepherd Dog, Caucasian Shepherd Dog",confident / calm / powerful,5,5,2,2,3,0,['Double'],3,3,3,3,3,3,3,5,25,29,77,132
221,Rat Terrier,"An American original, with a breed name said to be coined by Teddy Roosevelt, the Rat Terrier is a compact, tough, smooth-coated exterminator dog. RTs come in two size varieties and are happy-go-lucky, playful, and portable companions.",Terrier Group,United States,12-18 years,"Toy Fox Terrier, Smooth Fox Terrier, American Hairless Terrier, Teddy Roosevelt Terrier, Parson Russell Terrier",friendly / inquisitive / lovable,4,5,3,2,5,0,['Smooth'],1,4,3,5,5,5,3,5,10,18,10,25
222,Redbone Coonhound,"The streamlined Redbone Coonhound, an American original, is even-tempered, mellow, and kindly at home but a tiger on the trail. Vigorous activities like hunting and swimming between long periods of rest is the rhythm of coonhound life.",Hound Group,United States,12-15 years,"American English Coonhound, Bluetick Coonhound, Plott Hound, Black and Tan Coonhound, Treeing Walker Coonhound",eager to please / even-tempered / amiable,4,5,4,2,5,0,['Smooth'],3,3,5,4,3,3,3,3,21,27,45,70
223,Rhodesian Ridgeback,"<p>The Rhodesian Ridgeback is an all-purpose 'Renaissance hound' whose hallmark is the ridge, or stripe of backward-growing hair, on his back. Though the breed was made famous in its native Africa for its skill at tracking and baying, but never, ever killing, &nbsp;lions, today Ridgebacks are cherished family dogs whose owners must be prepared to deal with their independence and strong prey drive.</p>",Hound Group,Zambia/Zimbabwe (formerly Rhodesia),10-12 years,"Boerboel, Thai Ridgeback, Weimaraner, Great Dane, Vizsla",dignified / affectionate / even-tempered,4,5,2,2,5,0,['Smooth'],2,3,3,4,3,3,3,4,24,27,70,85
224,Romanian Carpathian Shepherd,"<p>The Romanian Carpathian Shepherd dog is a natural guardian, very courageous and loyal, distinguishing itself by its unconditional attachment and devotion to the whole family, or the herd it protects and to its master. The Carpathian is a dignified, proud, calm, and balanced dog.</p>",Foundation Stock Service,Romania,12-14 years,Anatolian Shepherd Dog,loyal / brave,3,3,3,2,4,0,['0'],1,2,3,5,3,3,3,1,23,29,70 - 100 lbs,70 - 100 lbs
225,Romanian Mioritic Shepherd Dog,<p>The Romanian Mioritic Shepherd Dog origins come from near the Carpathian Mountains. The breed is very impressive in size and character.</p>,Foundation Stock Service,Romania,12-14 years,"Great Pyrenees, Pyrenean Mastiff, Anatolian Shepherd Dog, Central Asian Shepherd Dog, Tibetan Mastiff",independent / loyal / confident guardian,3,5,1,2,5,0,['Double'],3,3,3,3,1,3,2,3,22.5,29,100,130
226,Rottweiler,"The Rottweiler is a robust working breed of great strength descended from the mastiffs of the Roman legions. A gentle playmate and protector within the family circle, the Rottie observes the outside world with a self-assured aloofness.",Working Group,Germany,9-10 years,"Doberman Pinscher, Staffordshire Bull Terrier, Cane Corso, German Pinscher, German Shepherd Dog",loyal / loving / confident guardian,4,5,1,1,3,0,['Smooth'],3,3,3,5,3,4,3,5,22,27,80,135
227,Russell Terrier,"Upbeat, lively, inquisitive, and friendly, the jaunty Russell Terrier was developed by England's ""Sporting Parson"" for use in foxhunts. The adorable Russell Terrier looks like a plush toy come to life but is an eager, tireless working terrier.",Terrier Group,England,12-14 years,"Parson Russell Terrier, Smooth Fox Terrier, Jagdterrier, Rat Terrier, Wire Fox Terrier",alert / inquisitive / lively,4,5,4,2,3,0,"['Smooth', 'Wiry']",1,5,5,5,5,5,3,3,10,12,9,15
228,Russian Toy,"<p>The Russian Toy is a small, elegant, lively dog with long legs, fine bones and lean muscles. They are active and cheerful, possessing keen intelligence and a desire to please. This breed loves to snuggle and be close to their human companions, although sometimes slightly aloof to strangers. They are neither cowardly nor aggressive.</p>",Toy Group,Russia,12-14 years,"Papillon, Chinese Crested, Manchester Terrier (Toy), Miniature Pinscher, Toy Fox Terrier",loyal / charming / smart,4,5,4,2,3,0,['Double'],1,3,3,3,3,4,3,4,8,11,6.5,6.5
229,Russian Tsvetnaya Bolonka,"<p>Russkaya Tsvetnaya Bolonka translates to ""Russian Colored Lapdog."" Bolonki were originally bred to be the ultimate house pet for apartment living. Sweet, loving, intelligent, and willing to please, he is friendly to all and shows no sign of aggression.</p>",Miscellaneous Class,Russia,14-20 years,"Bolognese, Lhasa Apso, Havanese, Coton de Tulear, Shih Tzu",playful / charming / inquisitive,5,5,1,3,5,0,['Wavy'],1,3,5,1,3,3,3,5,11,11,6,9
230,Saint Bernard,"<p>The Saint Bernard does not rank very high in AKC registrations, but the genial giant of the Swiss Alps is nonetheless among the world's most famous and beloved breeds. Saints are famously watchful and patient companions with a fondness for children.</p>",Working Group,Switzerland,8-10 years,"Pyrenean Mastiff, Bernese Mountain Dog, Tibetan Mastiff, Spanish Mastiff, Caucasian Shepherd Dog",playful / charming / inquisitive,4,5,1,2,5,0,"['Double', 'Rough', 'Smooth']",5,3,3,3,3,3,3,3,26,30,120,180
231,Saluki,"Among the world's oldest breeds, the slim but rugged Saluki was the hunting hound of kings for thousands of years. Salukis are swift and agile sprinters who love a good chase. They make gentle, dignified, and independent but loyal pets.",Hound Group,Middle East,10-17 years,"Sloughi, Azawakh, Pharaoh Hound, Greyhound, Afghan Hound",dignified / gentle / independent-minded,3,5,3,1,3,0,['Smooth'],1,4,3,5,3,3,2,3,23,28,40,65
232,Samoyed,"<p>The Samoyed is a substantial but graceful dog standing anywhere from 19 to a bit over 23 inches at the shoulder. Powerful, tireless, with a thick all-white coat impervious to cold, Sammies are perfectly beautiful but highly functional. Even their most delightful feature, a perpetual smile, has a practical function: The upturned corners of the mouth keep Sammies from drooling, preventing icicles from forming on the face. &nbsp;A Sammy sentenced to solitary confinement in the yard is a miserable and destructive creature. These are smart, social, mischievous dogs who demand love and attention. Sammies need structure in training. Teach them what's expected of them early, and practice it with them often.</p>",Working Group,Siberia,12-14 years,"Yakutian Laika, Siberian Husky, Norwegian Elkhound, Swedish Lapphund, Lapponian Herder",friendly / gentle / adaptable,4,5,5,3,5,0,['Double'],1,4,3,4,5,5,3,4,19,23.5,35,65
233,Schapendoes,"<p>This shaggy sheepdog of Holland is also known as the Dutch Sheep Dog. Schapendoes are cheerful, funny, clever and brave and are very good family pets. They also have a strong desire to please.</p>",Foundation Stock Service,The Netherlands,12-15 years,"Polish Lowland Sheepdog, Bearded Collie, Portuguese Sheepdog, Romanian Mioritic Shepherd Dog, Bergamasco Sheepdog",friendly / watchful / lively,4,5,3,3,3,0,['Double'],2,4,5,4,3,4,2,5,16,20,26,55
234,Schipperke,"The Schipperke, Belgium's ""little captain,"" is the traditional barge dog of the Low Countries. Curious, lively, and intense but mischievous, this little black dog is a robust, long-lived companion for whom there is never a dull moment.",Non-Sporting Group,Belgium,12-16 years,"American Eskimo Dog, German Spitz, Danish-Swedish Farmdog, Brussels Griffon, Keeshond",alert / curious / confident,4,5,4,2,3,0,['Double'],1,3,3,3,3,4,3,4,10,13,10,16
235,Scottish Deerhound,"<p>The crisply coated Scottish Deerhound, 'Royal Dog of Scotland,' is a majestically large coursing hound struck from the ancient Greyhound template. Among the tallest of dog breeds, the Deerhound was bred to stalk the giant wild red deer.</p>",Hound Group,Scotland,8-11 years,"Greyhound, Irish Wolfhound, Otterhound, Afghan Hound, Borzoi",dignified / gentle / polite,3,5,1,1,3,0,"['Double', 'Wiry']",1,3,5,3,3,3,3,3,28,32,75,110
236,Scottish Terrier,"A solidly compact dog of vivid personality, the Scottish Terrier is an independent, confident companion of high spirits. Scotties have a dignified, almost-human character. Their terrier persistence has earned the breed the nickname 'the Diehard.'",Terrier Group,Scotland,12 years,"Skye Terrier, Cairn Terrier, West Highland White Terrier, Soft Coated Wheaten Terrier, Kerry Blue Terrier",independent / confident / spirited,4,5,4,3,3,0,"['Double', 'Wiry']",2,3,2,4,3,4,2,3,10,10,18,22
237,Sealyham Terrier,"The Sealyham Terrier is brave and spirited, but not as spiky as smaller terriers. These sturdy, outgoing companions are recognized by their 'fall,' the mass of hair covering the forehead. Sealy fans enjoy their dog's sly sense of humor.",Terrier Group,Wales,12-14 years,"Glen of Imaal Terrier, Norfolk Terrier, Norwich Terrier, Scottish Terrier, Dandie Dinmont Terrier",alert / outgoing / sense of humor,4,5,4,3,3,0,"['Double', 'Wiry']",1,3,3,4,4,3,3,4,10.5,10.5,23,24
238,Segugio Italiano,"<p>The Segugio Italiano is a loyal and personable breed of great stamina, great heart, and impeccable intelligence.</p>",Foundation Stock Service,Italy,11-13 years,"Bracco Italiano, Transylvanian Hound, Porcelaine, Hanoverian Scenthound, Black and Tan Coonhound",intelligent / friendly / eager to please,3,3,3,1,5,0,['0'],1,3,5,1,1,1,3,5,19,24.5,39,62
239,Shetland Sheepdog,"The Shetland Sheepdog, also known as the Sheltie, is an extremely intelligent, quick, and obedient herder from Scotland's remote and rugged Shetland Islands. Shelties bear a strong family resemblance to their bigger cousin, the Collie.",Herding Group,Scotland,12-14 years,"Collie, Border Collie, Icelandic Sheepdog, Miniature American Shepherd, Australian Shepherd",playful / energetic / bright,5,5,5,3,5,0,['Double'],1,4,5,4,2,5,3,5,13,16,15,25
240,Shiba Inu,"An ancient Japanese breed, the Shiba Inu is a little but well-muscled dog once employed as a hunter. Today, the spirited, good-natured Shiba is the most popular companion dog in Japan. The adaptable Shiba is at home in town or country.",Non-Sporting Group,Japan,13-16 years,"Akita, Kishu Ken, Kai Ken, Shikoku, Hokkaido",alert / active / attentive,3,5,3,2,3,0,['Double'],1,3,3,4,3,3,3,2,13.5,16.5,17,23
241,Shih Tzu,"That face! Those big dark eyes looking up at you with that sweet expression! It's no surprise that Shih Tzu owners have been so delighted with this little 'Lion Dog' for a thousand years. Where Shih Tzu go, giggles and mischief follow.",Toy Group,China,10-18 years,"Tibetan Spaniel, Tibetan Terrier, Russian Tsvetnaya Bolonka, Lhasa Apso, Havanese",playful / affectionate / outgoing,5,5,3,4,5,0,['Double'],1,3,5,3,3,3,1,4,9,10.5,9,16
242,Shikoku,"<p>The Shikoku is a dog of marked endurance, keen in sense with a naive feeling, energetic and highly alert. He is an enthusiastic hunter and docile towards his master.</p>",Foundation Stock Service,Japan,10-12 years,"Kishu Ken, Kai Ken, Shiba Inu, Chow Chow, Hokkaido",alert / energetic / enthusiastic,3,3,3,3,3,0,['Double'],1,3,3,3,3,3,3,3,17,22,35,55
243,Siberian Husky,"Siberian Husky, a thickly coated, compact sled dog of medium size and great endurance, was developed to work in packs, pulling light loads at moderate speeds over vast frozen expanses. Sibes are friendly, fastidious, and dignified.",Working Group,Siberia,12-14 years,"Alaskan Malamute, Yakutian Laika, Akita, Chinook, Samoyed",Loyal / Outgoing / mischievous,4,5,5,2,5,0,['Double'],1,5,5,4,5,5,4,3,20,23.5,35,60
244,Silky Terrier,"<p>A charming member of the AKC Toy Group, the compact, glossy-coated Silky Terrier is nonetheless a true terrier of energetic high spirits. The Silky, a native of Sydney, Australia, is larger than his close cousin, the Yorkshire Terrier.</p>",Toy Group,Australia,13-15 years,"Maltese, Biewer Terrier, Skye Terrier, Australian Terrier, Yorkshire Terrier",friendly / quick / keenly alert,4,5,4,3,3,0,['Silky'],1,3,3,3,4,4,2,4,9,10,10,10
245,Skye Terrier,"The heavenly breed with the heart of a lion,' the long, low, and level Skye Terrier is among the AKC's most distinctive-looking breeds. This elegant but sturdy aristocrat was bred as an exterminator on Scotland's remote Isle of Skye.",Terrier Group,Scotland,12-14 years,"Cesky Terrier, West Highland White Terrier, Cairn Terrier, Glen of Imaal Terrier, Scottish Terrier",courageous / good-tempered / canny,3,5,3,3,3,0,['Double'],1,3,3,3,3,3,3,3,9.5,10,35,45
246,Sloughi,"<p>The ancient Sloughi, nicknamed the 'Arabian Greyhound,' is a lean, swift coursing hound who hunted a variety of game in North African deserts. A classic sighthound, the Sloughi is regally aloof with strangers and gentle with loved ones.</p>",Hound Group,Arabian Greyhound,10-15 years,"Azawakh, Saluki, Borzoi, Greyhound, Pharaoh Hound",reserved / graceful / noble,3,4,2,1,3,0,['Smooth'],1,4,3,3,2,3,3,3,24,29,45,65
247,Slovakian Wirehaired Pointer,"<p>Slovakian Wirehaired Pointer is a dog of moderate strength, working type, but with nobleness in his lines.</p>",Foundation Stock Service,Czechoslovakia,12-15 years,"Vizsla, Pointer, Czechoslovakian Vlciak, German Wirehaired Pointer, Pudelpointer",,3,5,3,1,3,0,['Wiry'],2,4,4,3,3,3,2,5,22.5,26.5,50,65
248,Slovensky Cuvac,"<p>The Slovensky Cuvac is boundlessly faithful and courageous and always ready to fight off any intruder, even if they are bears and wolves. In order to distinguish him from wild animals in the night, he is, according to ancient tradition, only bred in white.</p>",Foundation Stock Service,Slovakia,11-13 years,"Great Pyrenees, Kuvasz, Slovensky Kopov, Czechoslovakian Vlciak, Tornjak",alert / courageous / faithful,3,5,1,2,3,0,['Double'],3,3,3,3,2,3,4,3,23,27.5,68,97
249,Slovensky Kopov,"<p>This spirited, persistent hunter will follow a scent for hours. The Slovensky Kopov is a hardy, hardworking breed that is also known for its courage and great endurance and was originally developed to hunt wild boar.</p>",Foundation Stock Service,Slovakia,12-13 years,"Bloodhound, Transylvanian Hound, Bavarian Mountain Scent Hound, Hanoverian Scenthound, Black and Tan Coonhound",alert / courageous / determined,3,5,3,1,3,0,['Rough'],2,3,4,3,3,3,3,4,16,20,33,44
250,Small Munsterlander,"The Small Munsterlander is a versatile hunting dog and natural retriever with a medium range, solid pointing instinct, and strong desire for the water. It has excellent tracking abilities for all types of work after the shot. These qualities are enhanced by intelligence and trainability.",Miscellaneous Class,Germany,12-14 years,"Deutscher Wachtelhund, Drentsche Patrijshond, Stabyhoun",intelligent / devoted / self-confident,3,5,1,1,4,0,['Double'],2,4,3,4,3,3,3,5,20.5,21,40,60
251,Smooth Fox Terrier,"The Smooth Fox Terrier, called the 'gentleman of the terrier world,' is a lively, gregarious terrier with a devil-may-care attitude, originally developed for Britain's traditional foxhunts. They are close relatives to <a href=""/dog-breeds/wire-fox-terrier/"">Wire Fox Terriers</a>.",Terrier Group,England,12-15 years,"Wire Fox Terrier, Parson Russell Terrier, Russell Terrier, Teddy Roosevelt Terrier, Toy Fox Terrier",independent / friendly / amusing,4,5,5,2,3,0,['Smooth'],1,4,3,3,3,4,3,3,15,15,15,18
252,Soft Coated Wheaten Terrier,"The Soft Coated Wheaten Terrier, an exuberant Irish farm dog, is happy, friendly, deeply devoted, and just stubborn enough to remind you he's a terrier. The unique wheaten coat is low-shedding but needs diligent care to avoid matting.",Terrier Group,Ireland,12-14 years,"Irish Terrier, Kerry Blue Terrier, Lakeland Terrier, Airedale Terrier, Glen of Imaal Terrier",friendly / happy / deeply devoted,3,5,3,4,5,0,"['Silky', 'Wavy']",2,4,3,3,3,3,1,3,17,19,30,40
253,Spanish Mastiff,"<p>The Spanish Mastiff is a very intelligent dog, not without beauty, whose expression manifests both these qualities. Rustic, affectionate, kind and noble, he is very determined when facing dangerous animals and in front of strangers, especially when he has the opportunity to defend and protect farms or cattle. In his behaviour, one can see it is a dog sure of himself, determining his strength because he is aware of his enormous power.</p>",Foundation Stock Service,Spain,10-12 years,"Neapolitan Mastiff, Pyrenean Mastiff, Tibetan Mastiff, Bullmastiff, Dogue de Bordeaux",intelligent / affectionate / kind,3,5,1,1,3,0,"['Double', 'Smooth']",5,3,3,3,3,2,3,3,28,35,140,200
254,Spanish Water Dog,"<p>The inexhaustible Spanish Water Dog is a dual-purpose breed whose hallmark is a coat of wooly curls. Used as both a herder and waterfowl retriever in his homeland, this rustic charmer is a lively family companion and vigilant watchdog.</p>",Herding Group,Spain,12-14 years,"Portuguese Water Dog, American Water Spaniel, Irish Water Spaniel, Barbet",Upbeat / Playful but also work-oriented / Very Active,3,5,3,4,4,0,"['Curly', 'Corded']",2,4,3,5,3,4,1,4,15.75,19.75,31,49
255,Spinone Italiano,"The Spinone Italiano, a densely-coated hunting dog, is sociable, docile, and patient, sometimes stubborn but always endearing. Of ancient Italian lineage, the Spinone is among the field dogs of Continental Europe famed for versatility.",Sporting Group,Italy,10-12 years,"Bracco Italiano, Segugio Italiano, Pudelpointer, Otterhound, Wirehaired Pointing Griffon",sociable / patient / docile,3,5,2,2,3,0,['Wiry'],3,3,4,3,3,3,3,4,22,27,31,49
256,Stabyhoun,"<p>Although occasionally somewhat willful by nature, Stabyhouns are obedient, gentle, and patient dogs, who are deeply fond of their family, wanting to please their owners. He is both a soft-mouthed retriever and a pointer that is particularly useful for hunting ducks and upland birds. He is a fine retriever, and water work is one of his fortes. He is very sharp-eyed, owns a good sense of smell and aptitude, and works fast and efficiently.</p>",Foundation Stock Service,The Netherlands,13-15 years,"Drentsche Patrijshond, Nederlandse Kooikerhondje, Deutscher Wachtelhund, Small Munsterlander, French Spaniel",intelligent / loving / responsive,3,5,3,1,5,0,"['Double', 'Smooth']",2,4,4,4,3,3,3,5,19,21,40,60
257,Staffordshire Bull Terrier,"<p>From his brawling past, the muscular but agile Staffordshire Bull Terrier retains the traits of courage and tenacity. Happily, good breeding transformed this former gladiator into a mild, playful companion with a special feel for kids.</p>",Terrier Group,England,12-14 years,"American Staffordshire Terrier, Bull Terrier, Miniature Bull Terrier, Bulldog, Boxer",clever / brave / tenacious,5,5,3,2,5,0,['Smooth'],3,4,3,4,4,4,2,5,14,16,24,38
258,Standard Schnauzer,"The bold, bewhiskered Standard Schnauzer is a high-spirited farm dog from Germany. They are the sometimes-willful but ever reliable medium-sized members of the Schnauzer family of breeds. The Standard's sporty look is a canine classic.",Working Group,Germany,13-16 years,"Miniature Schnauzer, Kerry Blue Terrier, Soft Coated Wheaten Terrier, German Pinscher, Giant Schnauzer",fearless / smart / spirited,4,5,3,3,5,0,"['Double', 'Wiry']",3,3,3,5,3,4,1,5,17.5,19.5,30,50
