105,English Foxhound,"<p>The English Foxhound is a substantial galloping hound of great stamina. His long legs are straight as a gatepost, and just as sturdy. The back is perfectly level. And the chest is very deep, 'girthing' as much as 31 inches on a hound measuring 24 inches at the shoulder, ensuring plenty of lung power for a grueling day's hunt. &nbsp;&nbsp;&nbsp;&nbsp;These pack-oriented, scent-driven hounds are gentle and sociable, but rarely seen as house pets. They can be so driven by a primal instinct for pursuit that not much else, including training, matters to them. Owning these noble creatures will require an owner who enjoys an active, social lifestyle.</p>",Hound Group,England,10-13 years,"American Foxhound, Hamiltonstovare, American English Coonhound, Beagle, Harrier",sociable / affectionate / gentle,4,5,5,1,5,0,['Double'],2,4,5,4,4,4,3,4,24,24,60,75
106,English Setter,"The English Setter is a medium-sized sporting dog of sweet temper and show-stopping good looks. It is one of the AKC's four British setters created to work on the distinctly different terrains of England, Ireland, and Scotland.",Sporting Group,England,12 years,"Irish Red and White Setter, Irish Setter, Pudelpointer, German Longhaired Pointer, Gordon Setter",friendly / mellow / merry,4,5,3,3,4,0,"['Silky', 'Double']",3,3,4,4,4,4,3,4,23,27,45,80
107,English Springer Spaniel,"The English Springer Spaniel is a sweet-faced, lovable bird dog of great energy, stamina, and brains. Sport hunters cherish the duality of working Springers: handsome, mannerly pets during the week, and trusty hunting buddies on weekends.",Sporting Group,England,12-14 years,"Welsh Springer Spaniel, English Cocker Spaniel, Clumber Spaniel, Sussex Spaniel, Field Spaniel",friendly / playful / obedient,4,5,3,2,3,0,['Double'],3,4,4,4,4,4,3,5,19,20,40,50
108,English Toy Spaniel,"<p>The merry English Toy Spaniel was bred to be the companion of kings. But ETS are spaniels first and pampered lapdogs second, and beneath the patrician exterior beats the heart of a real doggy dog-bright, loving, and willing to please.</p>",Toy Group,England,10-12 years,"Cavalier King Charles Spaniel, Japanese Chin, Chihuahua, Pekingese, Affenpinscher",intelligent / playful / gentle,4,5,2,3,5,0,"['Silky', 'Double']",2,3,5,3,3,4,3,3,9,10,8,14
109,Entlebucher Mountain Dog,"The Entlebucher Mountain Dog, tricolor 'Laughing Dog' of the Swiss Alps, is a rugged and determined mover of cattle. These spirited, energetic workers and athletes are independent problem solvers and are happiest with a job to perform.",Herding Group,Switzerland,11-13 years,"Bernese Mountain Dog, Appenzeller Sennenhund, Bavarian Mountain Scent Hound, Rottweiler, Greater Swiss Mountain Dog",loyal / smart / enthusiastic,4,5,3,1,3,0,['Smooth'],2,5,5,4,3,3,3,3,16.5,20.5,40,65
110,Estrela Mountain Dog,"<p>The Estrela Mountain Dog is not only an excellent livestock guardian, but is also known for his love of children and family. Proper socialization and training as a puppy is very important so that the dominance in the Estrela's personality does not become aggressive.</p>",Foundation Stock Service,England,10-14 years,"Leonberger, Newfoundland, Great Pyrenees, Saint Bernard, Kuvasz",alert / intelligent / brave,3,5,3,2,5,0,"['Wavy', 'Double']",4,3,3,3,2,3,3,4,24.5,29,77,132
111,Eurasier,"<p>The Eurasier is a medium-sized dog with a thick, medium-long coat that can come in a variety of colors. Confident, calm, and well-balanced, he is loyal to the entire family, but reserved towards strangers. He must live in close contact with his family, as he is not suited to be kept in kennels or tied up outside.</p>",Foundation Stock Service,Germany,12-16 years,"Keeshond, Icelandic Sheepdog, Hokkaido, Akita, Chow Chow",confident / calm / family-oriented,3,4,3,3,4,0,['Double'],2,3,3,4,2,3,3,4,19,24,40,70
112,Field Spaniel,"<p>The sweet and sensitive Field Spaniel is famously docile, but vigorous and game for anything when at play or in the field. These close cousins to Cocker Spaniels and Springer Spaniels may be small in number, but their charm is enormous.</p>",Sporting Group,England,12-13 years,"English Cocker Spaniel, English Springer Spaniel, Sussex Spaniel, Clumber Spaniel, Welsh Springer Spaniel",sweet / fun-loving / sensitive,4,5,3,2,5,0,"['Wavy', 'Smooth']",2,3,4,3,4,3,3,5,17,18,35,50
113,Finnish Lapphund,The weatherproof Finnish Lapphund is a tough and substantial reindeer herder from north of the Arctic Circle. This remarkably empathetic breed is among the friendliest of all dogs'once he's satisfied that you aren't a reindeer rustler.,Herding Group,Finland,12-15 years,"Icelandic Sheepdog, Norwegian Elkhound, Finnish Spitz, Yakutian Laika, Swedish Vallhund",alert / friendly / agile,4,5,5,2,4,0,['Double'],2,3,3,3,4,3,4,4,16,21,33,53
114,Finnish Spitz,"The lively Finnish Spitz, the flame-colored, foxy-faced breed from the 'Land of 60,000 Lakes,' is a small but fearless hunting dog whose unique style of tracking and indicating quarry has earned him the nickname the 'Barking Bird Dog.'",Non-Sporting Group,Finland,13-15 years,"Norwegian Buhund, Icelandic Sheepdog, Swedish Lapphund, Finnish Lapphund, Norwegian Elkhound",good-natured / friendly / lively,4,5,5,2,5,0,['Double'],2,5,4,4,3,3,3,3,15.5,20,20,33
115,Flat-Coated Retriever,"The Peter Pan of the Sporting Group, the forever-young Flat-Coated Retriever is a gundog of relatively recent origin. Happy, self-assured, and willing to please, a good Flat-Coat will retrieve a duck or a show ribbon with equal aplomb.",Sporting Group,England,8-10 years,"Golden Retriever, Curly-Coated Retriever, Chesapeake Bay Retriever, Nova Scotia Duck Tolling Retriever, Labrador Retriever",cheerful / optimistic / good-humored,5,5,3,2,5,0,['Smooth'],2,5,5,4,5,5,3,5,22,24.5,60,70
116,French Bulldog,"<p>The one-of-a-kind French Bulldog, with his large bat ears and even disposition, is one of the world's most popular small-dog breeds, especially among city dwellers. The Frenchie is playful, alert, adaptable, and completely irresistible.</p>",Non-Sporting Group,England,10-12 years,"Boston Terrier, Bulldog, Bull Terrier, Miniature Bull Terrier, Pug",playful / smart / adaptable,5,5,1,1,5,0,['Smooth'],3,3,4,3,5,5,3,4,11,13,28,28
117,French Spaniel," The French Spaniel is balanced, frank, gentle, calm and docile. He is an enthusiastic hunter, sociable with other dogs and an ideal companion in all circumstances. An excellent pointing dog, he also has a talent for retrieving.",Foundation Stock Service,France,10-12 years,"Field Spaniel, Boykin Spaniel, Brittany, Drentsche Patrijshond",intelligent / sociable / gentle,5,5,3,1,5,0,['Smooth'],2,4,5,5,5,4,3,5,21.5,24,50,60
118,German Longhaired Pointer,"<p>A good way to describe the German Longhaired Pointer is that, in appearance, it's Continental Europe's version of a Setter: a pointing dog with full tail and a long coat with dense guard hairs and a moderate undercoat. One noteworthy difference is the GLP's affection for swimming and, therefore, waterfowl hunting. Coat color reflects the mixture of markings similar to a German Shorthaired Pointer.</p>",Foundation Stock Service,Germany,12-14 years,"German Wirehaired Pointer, French Spaniel, German Shorthaired Pointer, Stabyhoun",versatile / calm / family-oriented,4,5,3,1,5,0,['Double'],2,4,4,4,4,4,3,5,22,28,55,80
119,German Pinscher,"<p>The sleek, no-frills German Pinscher is among Germany's oldest breeds and the prototype of other pinscher breeds. This energetic, super-intelligent dog was at first used as a rat catcher but can be trained for all types of canine work.</p>",Working Group,Germany,12-14 years,"Doberman Pinscher, Jagdterrier, Miniature Pinscher",intelligent / courageous / vivacious,3,5,3,1,3,0,['Smooth'],1,5,3,4,3,4,3,5,17,20,25,45
120,German Shepherd Dog,"Generally considered dogkind's finest all-purpose worker, the German Shepherd Dog is a large, agile, muscular dog of noble character and high intelligence. Loyal, confident, courageous, and steady, the German Shepherd is truly a dog lover's delight.",Herding Group,Germany,12-14 years,"Belgian Malinois, Czechoslovakian Vlciak, Belgian Sheepdog, Dutch Shepherd, Belgian Tervuren",courageous / confident / smart,5,5,3,2,5,0,['Double'],2,5,3,5,3,4,4,5,22,26,50,90
121,German Shorthaired Pointer,"The versatile, medium-sized German Shorthaired Pointer is an enthusiastic gundog of all trades who thrives on vigorous exercise, positive training, and a lot of love. GSP people call their aristocratic companions the 'perfect pointer.'",Sporting Group,Germany,10-12 years,"German Wirehaired Pointer, Portuguese Pointer, Slovakian Wirehaired Pointer, German Longhaired Pointer, Pointer",friendly / smart / willing to please,4,5,3,2,5,0,['Smooth'],2,5,4,5,4,4,3,5,21,25,45,70
122,German Spitz,"<p>The German Spitz is always attentive, lively and exceptionally devoted to his owner. He is very teachable and easy to train. His distrust towards strangers and lack of hunting instinct make him the ideal watchdog for the home. His indifference to weather, robustness and longevity are his most outstanding attributes.</p>",Miscellaneous Class,Germany,13-15 years,"Pomeranian, Keeshond, Papillon, Chihuahua, American Eskimo Dog",active / devoted / smart,3,1,5,3,3,0,[],1,3,3,5,1,4,3,5,12,15,24,26
123,German Wirehaired Pointer,"With his sporty weatherproof coat and can-do attitude, the noble German Wirehaired Pointer is a versatile, sturdy gundog who thrives on outdoor activity. Around the house, the GWP is an eager, affectionate, and amusing family companion.",Sporting Group,Germany,14-16 years,"German Shorthaired Pointer, Wirehaired Vizsla, Pudelpointer, Slovakian Wirehaired Pointer, Wirehaired Pointing Griffon",affectionate / eager / enthusiastic,4,5,3,2,3,0,"['Double', 'Wiry']",2,5,3,4,4,4,2,5,22,26,50,70
124,Giant Schnauzer,"<p>The Giant Schnauzer is a larger and more powerful version of the Standard Schnauzer, and he should, as the breed standard says, ""be a bold and valiant figure of a dog."" Great intelligence and loyalty make him a stellar worker and companion.</p>",Working Group,Germany,10-13 years,"Standard Schnauzer, Black Russian Terrier, Great Dane, Bouvier des Flandres, Miniature Schnauzer",alert / loyal / trainable,4,4,3,4,3,0,"['Double', 'Wiry']",2,5,3,5,2,5,2,3,23.5,27.5,55,95
125,Glen of Imaal Terrier,"Gentler, less excitable than most terriers, but still bold and spirited, the double-coated Glen of Imaal Terrier is named for one of Ireland's most remote locales. The brave but docile Glen is a strong, no-fuss dog built for hard work.",Terrier Group,Ireland,10-15 years,"Skye Terrier, Dandie Dinmont Terrier, Norfolk Terrier, Sealyham Terrier, Norwich Terrier",spirited / gentle / bold,4,5,2,3,3,0,['Wiry'],2,3,3,3,3,3,2,3,12.5,14,32,40
126,Golden Retriever,"The Golden Retriever, an exuberant Scottish gundog of great beauty, stands among America's most popular dog breeds. They are serious workers at hunting and field work, as guides for the blind, and in search-and-rescue, enjoy obedience and other competitive events, and have an endearing love of life when not at work.",Sporting Group,Scotland,10-12 years,"Labrador Retriever, Flat-Coated Retriever, Chesapeake Bay Retriever, Curly-Coated Retriever, Nova Scotia Duck Tolling Retriever",intelligent / friendly / devoted,5,5,1,2,5,0,['Double'],2,3,5,4,5,4,4,5,21.5,24,55,75
127,Gordon Setter,"The Gordon Setter, the black avenger of the Highlands, is a substantial bird dog named for a Scottish aristocrat. Athletic and outdoorsy, Gordons are bold, confident, and resolute in the field, and sweetly affectionate by the fireside.",Sporting Group,Scotland,12-13 years,"English Setter, Collie, Irish Red and White Setter, Border Collie, Irish Setter",confident / affectionate / bold,4,5,3,2,3,0,['Double'],4,5,3,4,3,3,3,5,23,27,45,80
128,Grand Basset Griffon Venden,"The Grand Basset Griffon Venden is a French scenthound. Somewhat active and never high-strung, yet GBGVs are busy dogs who don't tire easily.",Hound Group,France,13-15 years,"Basset Hound, Otterhound, Wirehaired Pointing Griffon, Basset Fauve de Bretagne",independent / outgoing / happy,4,5,4,2,3,0,"['Double', 'Wiry']",2,5,4,4,5,4,3,3,15.5,18,40,45
129,Great Dane,"<p>The easygoing Great Dane, the mighty ""Apollo of Dogs,"" is a total joy to live with, but owning a dog of such imposing size, weight, and strength is a commitment not to be entered into lightly. This breed is indeed great, but not a Dane.</p>",Working Group,Germany,7-10 years,"Mastiff, Weimaraner, Beauceron, German Pinscher, Doberman Pinscher",friendly / patient / dependable,4,5,3,1,3,0,['Smooth'],4,4,3,4,3,4,3,3,28,32,110,175
130,Great Pyrenees,"The Great Pyrenees is a large, thickly coated, and immensely powerful working dog bred to deter sheep-stealing wolves and other predators on snowy mountaintops. Pyrs today are mellow companions and vigilant guardians of home and family.",Working Group,France,10-12 years,"Pyrenean Mastiff, Kuvasz, Braque Francais Pyrenean, Pyrenean Shepherd, Slovensky Cuvac",smart / patient / calm,3,5,3,2,3,0,['Double'],3,3,3,3,3,3,3,3,25,32,85,100
131,Greater Swiss Mountain Dog,"<p>The Greater Swiss Mountain Dog is a large, immensely strong worker famous for a dense coat of striking black, red, and white markings. Dependable and faithful Swissies earned their feed as herders, drafters, and all-around pasture dogs.</p>",Working Group,Switzerland,8-11 years,"Bernese Mountain Dog, Appenzeller Sennenhund, Rottweiler, Saint Bernard, Entlebucher Mountain Dog",faithful / family-oriented / dependable,3,5,3,2,5,0,['Smooth'],3,4,3,4,5,4,3,4,23.7,28.5,85,140
132,Greyhound,"The champion sprinter of dogdom, the Greyhound is a gentle, noble, and sweet-tempered companion with an independent spirit. For thousands of years these graceful hounds have been an object of fascination for artists, poets, and kings.",Hound Group,Egypt,10-13 years,"Italian Greyhound, Whippet, Saluki, Azawakh, Sloughi",independent / gentle / noble,4,4,3,1,3,0,['Smooth'],1,4,4,3,3,3,2,3,27,30,60,70
133,Hamiltonstovare,"<p>The Hamiltonstovare is a versatile scent hound, bred to hunt hare and fox in Sweden. When not hunting, they can be found in the show ring, as their striking color makes them a stunning show dog. Hamiltons have been used as service dogs in America since the late 90's, where their versatility and close bond with their people shine.</p>",Foundation Stock Service,Sweden,14-17 years,"Harrier, English Foxhound, American Foxhound, Bavarian Mountain Scent Hound, Transylvanian Hound",versatile / agile / regal,3,5,3,2,5,0,['Smooth'],2,4,3,4,5,4,3,4,19,24,40,75
134,Hanoverian Scenthound,"<p>The Hanoverian Scenthound has a calm and assured temperament, at the same time sensitive with his handler, and choosy and discerning with strangers. He has high capabilities of concentration in any tracking work with strong loyalty to the hunter in charge.</p>",Foundation Stock Service,Germany,10-14 years,"Bloodhound, Transylvanian Hound, Rhodesian Ridgeback, Hamiltonstovare, Bavarian Mountain Scent Hound",independent / loyal / calm,3,3,4,2,3,0,['Smooth'],2,4,5,3,3,3,3,4,19,21,79,99
135,Harrier,"<p>The Harrier is a swift, prey-driven pack hound of medium size first bred in medieval England to chase the hare. Outgoing and friendly, the Harrier is much larger than the Beagle but smaller than another close relative, the English Foxhound.</p>",Hound Group,England,12-15 years,"American Foxhound, English Foxhound, Transylvanian Hound, Beagle, Hamiltonstovare",friendly / outgoing / people-oriented,4,5,5,1,5,0,['Double'],2,4,5,4,4,4,3,4,19,21,45,60
136,Havanese,"Havanese, the only dog breed native to Cuba, are cheerful little dogs with a spring in their step and a gleam in their big, brown eyes. These vivacious and sociable companions are becoming especially popular with American city dwellers.",Toy Group,Cuba,14-16 years,"Lhasa Apso, Bolognese, Coton de Tulear, Russian Tsvetnaya Bolonka, Silky Terrier",intelligent / outgoing / funny,5,5,4,3,5,0,"['Silky', 'Double']",1,3,5,3,5,5,2,4,8.5,11.5,7,13
137,Hokkaido,"<p>The Hokkaido is a dog of noteworthy endurance and dignity. His temperament is faithful, docile, very alert and bold. He also shows accurate judgement and great stamina.</p>",Foundation Stock Service,Japan,12-15 years,"Kai Ken, Shikoku, Kishu Ken, Akita, Shiba Inu",dignified / alert / devoted,3,5,3,2,3,0,['Double'],2,4,3,4,3,3,3,4,18,20,44,66
138,Hovawart,"<p>The Hovawart is a medium-temperament working dog with versatile usage and has a very good nose. He is kind, has an even disposition and protective instinct, is self-confident and has the ability to take stress. His balanced body proportions and special devotion to his family make him an outstanding companion, watch, guard, tracking and rescue-dog.</p>",Foundation Stock Service,Germany,10-14 years,"Estrela Mountain Dog, Bernese Mountain Dog, Great Pyrenees, Kuvasz, Leonberger",alert / intelligent / faithful,4,5,1,2,4,0,['Double'],2,3,4,4,4,4,3,4,23,28,65,90
139,Ibizan Hound,"<p>The Ibizan Hound is a lithe and leggy visitor from the dawn of civilization, bred as a rabbit courser on the rocky shores of Spain's Balearic Islands. World-class sprinters and leapers, Ibizans need ample space to air out their engines.</p>",Hound Group,Spain,11-14 years,"Pharaoh Hound, Basenji, Greyhound, Portuguese Podengo, Cirneco dell'Etna",family-oriented / even-tempered / polite,4,5,3,1,3,0,"['Smooth', 'Wiry']",1,5,5,5,3,4,2,3,22.5,27.5,45,50
140,Icelandic Sheepdog,"<p>The Icelandic Sheepdog, Iceland's only native dog breed, is a charmingly friendly and faithful all-around herder of small-to-medium size. A densely coated Nordic spitz-type breed, Icelandics are enthusiastically devoted to their humans.</p>",Herding Group,Iceland,12-14 years,"Finnish Lapphund, Norwegian Buhund, Eurasier, Keeshond, Swedish Lapphund",friendly / playful / inquisitive,4,5,4,2,5,0,['Double'],2,4,4,5,3,3,3,5,16.5,18,25,30
141,Irish Red and White Setter,"<p>The rollicking Irish Red and White Setter is an athletic medium-sized bird dog bred primarily for hunting. Fun-loving, friendly, and high-spirited, Irish Red and Whites are a bit shorter and stockier than their cousin the Irish Setter.</p>",Sporting Group,Ireland,11-15 years,"English Setter, Irish Setter, English Springer Spaniel, Welsh Springer Spaniel, Gordon Setter",courageous / spirited / determined,5,5,3,2,5,0,"['Silky', 'Double']",2,5,5,3,5,3,2,5,22.5,26,35,60
142,Irish Setter,"The Irish Setter is a high-spirited gundog known for grace, swiftness, and a flashy red coat. They are famously good family dogs: sweet-tempered companions for the folks, and rollicking playmates and tennis-ball fetchers for the children.",Sporting Group,Ireland,12-15 years,"English Setter, Irish Red and White Setter, English Springer Spaniel, Brittany, Gordon Setter",active / sweet-natured / outgoing,4,5,3,3,5,0,['Silky'],2,5,5,4,5,5,3,4,25,27,60,70
143,Irish Terrier,"The Irish Terrier, 'Daredevil' of the Emerald Isle, is a bold, dashing, and courageous terrier of medium size. Known for his fiery red coat and a temperament to match, the Irish Terrier is stouthearted at work and tenderhearted at home.",Terrier Group,Ireland,13-15 years,"Welsh Terrier, Lakeland Terrier, Soft Coated Wheaten Terrier, Kerry Blue Terrier, Airedale Terrier",bold / dashing / tenderhearted,4,5,3,1,5,0,"['Double', 'Wiry']",1,3,1,4,3,3,2,3,18,18,25,27
144,Irish Water Spaniel,"The tallest of the AKC's spaniels, the Irish Water Spaniel is instantly recognizable by its crisply curled coat and tapering 'rat tail.' Among the champion swimmers of dogdom, the alert and inquisitive IWS is hardworking and brave in the field, and playfully affectionate at home.",Sporting Group,Ireland,12-13 years,"American Water Spaniel, Barbet, Portuguese Water Dog, Spanish Water Dog",playful / hardworking / brave,4,5,1,3,3,0,['Curly'],2,3,3,4,3,5,1,5,21,24,45,68
145,Irish Wolfhound,"<p>The calm, dignified, and kindly Irish Wolfhound is the tallest of all AKC breeds. Once fearless big-game hunters capable of dispatching a wolf in single combat, Wolfhounds today are the most serene and agreeable of companions.</p>",Hound Group,Ireland,6-8 years,"Scottish Deerhound, Greyhound, Afghan Hound, Great Dane, Borzoi",dignified / courageous / calm,3,5,1,2,3,0,['Wiry'],2,3,4,3,3,3,3,3,30,32,105,120
146,Italian Greyhound,"A true Greyhound in miniature, the elegant Italian Greyhound is an alert, playful, and highly affectionate toy companion. IGs make decorative couch dogs, but at heart they are flash-and-dash coursing hounds with an instinct for pursuit.",Toy Group,The Mediterranean basin,14-15 years,"Whippet, Greyhound, Toy Fox Terrier, Miniature Pinscher",alert / playful / sensitive,4,5,3,1,3,0,['Smooth'],1,3,5,3,5,4,3,4,13,15,7,14
147,Jagdterrier,"<p>Also known as the Deutscher Jagdterrier, the Jagdterrier is courageous, enduring, vital, full of temperament, reliable, sociable and trainable. He always takes pleasure in his work.</p>",Foundation Stock Service,Germany,10-12 years,"Border Terrier, Smooth Fox Terrier, Dachshund, Australian Terrier, Wire Fox Terrier",intelligent / courageous / hardworking,3,5,1,1,3,0,"['Rough', 'Smooth', 'Wiry']",1,3,3,4,3,4,2,3,13,16,17,22
148,Japanese Akitainu,"<p>Descending from regional hunting dogs, the Japanese Akitainu was initially restored and preserved by dedicated breeders in the Akitainu Hozonkai (Akita Dog Preservation Society; AKIHO). The breed is known for its striking appearance and its physical and mental agility.</p>
<p><br>
 Club Contact</p>
<p>Japanese Akitainu Club of America - akita-inu.com</p>
<p>Email: info@akita-inu.com</p>",Miscellaneous Class,Japan,10-12 years,"Akita, Shikoku, Kai Ken, Kishu Ken",dignified / alert / aloof,3,1,3,3,3,0,['Double'],1,3,1,3,1,3,5,1,22,27.5,55,75
149,Japanese Chin,"The Japanese Chin is a charming toy companion of silky, profuse coat and an unmistakably aristocratic bearing. Often described as a distinctly 'feline' breed, this bright and amusing lapdog is fastidious, graceful, and generally quiet.",Toy Group,Japan,10-12 years,"Pekingese, Shih Tzu, Chihuahua, Tibetan Spaniel, English Toy Spaniel",charming / loving / noble,4,5,2,2,3,0,['Silky'],1,3,5,3,3,3,3,3,8,11,7,11
150,Japanese Spitz,"<p>The Japanese Spitz are little comedians who want to make you happy and laugh. They are very loyal and smart and make wonderful companions. Game for adventures, they will tag along on a hike, a car ride, or a trip to the beach or lake. They love their humans and just enjoy being with them.</p>",Foundation Stock Service,Japan,10-14 years,"Affenpinscher, American Eskimo Dog, German Spitz","loyal, playful, smart",5,3,3,3,5,0,['Double'],1,3,5,3,5,3,3,5,12,15,10,25
151,Japanese Terrier,"<p>Japanese Terriers are a small, highly intelligent breed full of terrier temperaments. They are independent, active, crisp, and lively. As one-person dogs, they are often reserved with strangers. Keen and alert, Japanese Terriers will hear the slightest noise and give warning to any stranger. He has no issue with respectful children and other dogs. As a sporting terrier and versatile, eager-to-learn dog, he has great athleticism and inborn instincts. By the 1900s, at the end of the Meiji Era, some of these best dogs were seen in the Kobe streets, and were called the ""Kobe Terriers"". The appearance of these ""Kobe Terriers"" was like a mix of the modern Smooth Fox Terriers and the Japanese Terriers. These dogs were the first terrier-type dogs to be bred in Japan. The dogs had several names like ""Oyuki Terriers"" and ""Mikado Terriers"", and were kept by the Japanese as well as some foreigners.</p>",Foundation Stock Service,Japan,13-15 years,"American Hairless Terrier, Toy Fox Terrier, Smooth Fox Terrier",reserved / independent / curious,5,3,1,2,3,0,['0'],1,3,3,3,3,3,3,1,10,13,10,12
152,Kai Ken,"<p>The Kai Ken is a medium-sized dog and is one of the six native Japanese breeds. Traditionally used to hunt a wide range of game in the mountains of Japan, the Kai Ken is considered a rare breed even in Japan. The Kai is highly intelligent and learns quickly. They seem to learn as fast as the other Japanese breeds if not faster. They are not as independent and are more willing to please their companions. The Japanese describe the Kai Ken as a trustworthy guardian and extremely devoted to his master.</p>",Miscellaneous Class,Japan,12-15 years,"Shikoku, Kishu Ken, Korean Jindo Dog, Hokkaido, Shiba Inu",loyal / intelligent / agile,3,5,3,1,3,0,['Double'],1,3,3,3,1,3,3,3,15.5,19.5,25,40
153,Karelian Bear Dog,"<p>The Karelian Bear Dog is an eager hunter and very independent, yet works cooperatively to mark game by barking. Their senses, especially smell, are sharp, thus the breed is suitable for big game hunting. They have a very good sense of direction, are balanced, courageous and persistent. This breed has a highly developed spirit for game and are very self-confident. They may be territorial towards other males, but are never aggressive towards people, though they may be slightly reserved.</p>",Foundation Stock Service,Finland,11-13 years,"Finnish Spitz, Norwegian Elkhound, Swedish Lapphund, Eurasier, Norwegian Buhund",independent / loyal / courageous,3,3,3,3,1,0,['Double'],2,3,3,3,3,3,3,4,19,23.5,44,49
154,Keeshond,"<p>The amiable Keeshond is a medium-sized spitz dog of ample coat, famous for the distinctive ""spectacles"" on his foxy face. Once a fixture on the canal barges of his native Holland, the Kees was, and remains, a symbol of Dutch patriotism.</p>",Non-Sporting Group,The Netherlands,12-15 years,"Icelandic Sheepdog, American Eskimo Dog, Pomeranian, German Spitz, Schipperke",friendly / lively / outgoing,5,5,4,3,5,0,['Double'],2,4,5,4,5,5,3,5,17,18,35,45
